{
  "version": "vate-0.2",
  "profile": "VATE-AL2-Verifier-Admission-v0.2",
  "receipt_type": "admission",
  "receipt_id": "admrec-20260701-a2a-agent-card-001",
  "issued_at": "2026-07-01T00:19:08Z",
  "expires_at": "2026-07-01T00:29:08Z",
  "verifier": {
    "id": "did:web:verifier.example",
    "key_id": "did:web:verifier.example#key-1"
  },
  "request": {
    "request_id": "areq-20260701-a2a-agent-card-001",
    "transaction_id": "txn-20260701-a2a-agent-card-001",
    "a2a_context_id": "ctx-a2a-agent-card-001",
    "a2a_task_id": "task-a2a-agent-card-001",
    "action": "crm.case.update",
    "input_hash": "sha-256:63df7b474543470da076083a08ea4290d9ce3411ae407669d87e65cbf27bb7e9"
  },
  "subject": {
    "principal": "did:web:user.example",
    "actor": "did:web:agent.example",
    "runtime": "spiffe://agent.example/workload/case-agent"
  },
  "evidence": [
    {
      "type": "signed_agent_card",
      "uri": "https://agent.example/.well-known/agent-card.json",
      "media_type": "application/json",
      "digest": {
        "alg": "sha-256",
        "value": "3ac7b45f5ddab0178d224ae31a617b8194569224f42758d2b8503ac101c457b0"
      },
      "verification": {
        "result": "verified",
        "checked_at": "2026-07-01T00:19:05Z",
        "method": "a2a-agent-card-detached-jws-fixture",
        "status_result": "active"
      }
    }
  ],
  "policy": {
    "policy_id": "al2-crm-case-update",
    "policy_version": "2026-07-01.1",
    "policy_ref": "https://verifier.example/policies/al2-crm-case-update/2026-07-01.1"
  },
  "decision": {
    "outcome": "allow",
    "reason_codes": [
      "EVIDENCE_VERIFIED",
      "POLICY_MATCH"
    ],
    "human_readable_summary": "The request is allowed because the digest-bound A2A signed Agent Card evidence and local policy checks passed."
  }
}
