{
  "version": "vate-0.2",
  "profile": "VATE-AL2-Verifier-Admission-v0.2",
  "receipt_type": "admission",
  "receipt_id": "admrec-20260701-replay-detected-001",
  "issued_at": "2026-07-01T00:11:08Z",
  "expires_at": "2026-07-01T00:21:08Z",
  "verifier": {
    "id": "did:web:verifier.example"
  },
  "request": {
    "request_id": "areq-20260701-replay-detected-001",
    "transaction_id": "txn-20260701-replay-detected-001",
    "action": "repo.pull_request.merge",
    "input_hash": "sha-256:replay-detected-input"
  },
  "subject": {
    "principal": "did:web:user.example",
    "actor": "did:web:agent.example",
    "runtime": "spiffe://agent.example/workload/repo-agent"
  },
  "evidence": [
    {
      "type": "admission_request",
      "uri": "https://verifier.example/vate/admission-requests/replay-detected-001",
      "digest": {
        "alg": "sha-256",
        "value": "replay-detected-digest"
      },
      "verification": {
        "result": "failed",
        "checked_at": "2026-07-01T00:11:05Z",
        "method": "replay-cache",
        "failure_reason": "The request nonce was already consumed."
      }
    }
  ],
  "policy": {
    "policy_id": "al2-repo-merge",
    "policy_version": "2026-07-01.1",
    "policy_ref": "https://verifier.example/policies/al2-repo-merge/2026-07-01.1"
  },
  "decision": {
    "outcome": "deny",
    "reason_codes": [
      "REPLAY_DETECTED",
      "FAIL_CLOSED"
    ]
  }
}
