{
  "version": "vate-0.2",
  "profile": "VATE-AL2-Verifier-Admission-v0.2",
  "receipt_type": "admission",
  "receipt_id": "admrec-20260701-status-revoked-001",
  "issued_at": "2026-07-01T00:09:08Z",
  "expires_at": "2026-07-01T00:19:08Z",
  "verifier": {
    "id": "did:web:verifier.example"
  },
  "request": {
    "request_id": "areq-20260701-status-revoked-001",
    "transaction_id": "txn-20260701-status-revoked-001",
    "action": "calendar.event.create",
    "input_hash": "sha-256:status-revoked-input"
  },
  "subject": {
    "principal": "did:web:user.example",
    "actor": "did:web:agent.example",
    "runtime": "spiffe://agent.example/workload/calendar-agent"
  },
  "evidence": [
    {
      "type": "status_bundle",
      "uri": "https://status.example/bundles/status-revoked-001",
      "digest": {
        "alg": "sha-256",
        "value": "4a2bf43c208f432cc9b7810ab0dc6f25706c084446aea6e01644768306971758"
      },
      "verification": {
        "result": "failed",
        "checked_at": "2026-07-01T00:09:05Z",
        "method": "status-check",
        "status_result": "revoked",
        "failure_reason": "Current status revoked the task-scoped authority."
      }
    }
  ],
  "policy": {
    "policy_id": "al2-calendar-write",
    "policy_version": "2026-07-01.1",
    "policy_ref": "https://verifier.example/policies/al2-calendar-write/2026-07-01.1"
  },
  "decision": {
    "outcome": "deny",
    "reason_codes": [
      "STATUS_REVOKED",
      "FAIL_CLOSED"
    ]
  }
}
