{
  "version": "vate-0.2",
  "profile": "VATE-AL2-Verifier-Admission-v0.2",
  "receipt_type": "admission",
  "receipt_id": "admrec-20260701-digest-mismatch-001",
  "issued_at": "2026-07-01T00:05:08Z",
  "expires_at": "2026-07-01T00:15:08Z",
  "verifier": {
    "id": "did:web:verifier.example"
  },
  "request": {
    "request_id": "areq-20260701-digest-mismatch-001",
    "transaction_id": "txn-20260701-digest-mismatch-001",
    "action": "crm.case.update",
    "input_hash": "sha-256:digest-mismatch-input"
  },
  "subject": {
    "principal": "did:web:user.example",
    "actor": "did:web:agent.example",
    "runtime": "spiffe://agent.example/workload/case-agent"
  },
  "evidence": [
    {
      "type": "admission_request",
      "uri": "https://verifier.example/vate/admission-requests/digest-mismatch",
      "digest": {
        "alg": "sha-256",
        "value": "bc0d3a6714b20db52f3cc74c6fbd94b15f380173f9272f69c9d2541ccd51af89"
      },
      "verification": {
        "result": "failed",
        "checked_at": "2026-07-01T00:05:05Z",
        "method": "digest-check",
        "failure_reason": "The digest-bound reference did not match the artifact."
      }
    }
  ],
  "policy": {
    "policy_id": "al2-crm-case-update",
    "policy_version": "2026-07-01.1",
    "policy_ref": "https://verifier.example/policies/al2-crm-case-update/2026-07-01.1"
  },
  "decision": {
    "outcome": "deny",
    "reason_codes": [
      "DIGEST_MISMATCH",
      "FAIL_CLOSED"
    ]
  }
}
