{
  "version": "vate-0.2",
  "profile": "VATE-AL2-Verifier-Admission-v0.2",
  "receipt_type": "admission",
  "receipt_id": "admrec-20260701-kid-mismatch-001",
  "issued_at": "2026-07-01T00:12:08Z",
  "expires_at": "2026-07-01T00:22:08Z",
  "verifier": {
    "id": "did:web:verifier.example"
  },
  "request": {
    "request_id": "areq-20260701-kid-mismatch-001",
    "transaction_id": "txn-20260701-kid-mismatch-001",
    "action": "storage.object.publish",
    "input_hash": "sha-256:kid-mismatch-input"
  },
  "subject": {
    "principal": "did:web:user.example",
    "actor": "did:web:agent.example",
    "runtime": "spiffe://agent.example/workload/publish-agent"
  },
  "evidence": [
    {
      "type": "runtime_attestation",
      "uri": "https://agent.example/attestations/runtime/kid-mismatch-001",
      "digest": {
        "alg": "sha-256",
        "value": "kid-mismatch-runtime-attestation-digest"
      },
      "verification": {
        "result": "failed",
        "checked_at": "2026-07-01T00:12:05Z",
        "method": "trust-bundle-lookup",
        "failure_reason": "Issuer was known but the presented key id was not trusted."
      }
    }
  ],
  "policy": {
    "policy_id": "al2-storage-publish",
    "policy_version": "2026-07-01.1",
    "policy_ref": "https://verifier.example/policies/al2-storage-publish/2026-07-01.1"
  },
  "decision": {
    "outcome": "deny",
    "reason_codes": [
      "UNKNOWN_TRUST_ANCHOR",
      "FAIL_CLOSED"
    ]
  }
}
