{
  "version": "vate-0.2",
  "profile": "VATE-AL2-Verifier-Admission-v0.2",
  "receipt_type": "admission",
  "receipt_id": "admrec-20260701-status-boundary-001",
  "issued_at": "2026-07-01T00:05:02Z",
  "expires_at": "2026-07-01T00:15:02Z",
  "verifier": {
    "id": "did:web:verifier.example"
  },
  "request": {
    "request_id": "areq-20260701-status-boundary-001",
    "transaction_id": "txn-20260701-status-boundary-001",
    "action": "crm.case.update",
    "input_hash": "sha-256:status-boundary-input"
  },
  "subject": {
    "principal": "did:web:user.example",
    "actor": "did:web:agent.example",
    "runtime": "spiffe://agent.example/workload/case-agent"
  },
  "evidence": [
    {
      "type": "status_bundle",
      "uri": "https://status.example/bundles/status-boundary-001",
      "digest": {
        "alg": "sha-256",
        "value": "3a44409a31226eb70df0e45612976b9b3c0da93774439e08133cb89dd971b7f0"
      },
      "verification": {
        "result": "verified",
        "checked_at": "2026-07-01T00:05:00Z",
        "method": "stapled-status",
        "status_result": "active"
      }
    }
  ],
  "policy": {
    "policy_id": "al2-crm-case-update",
    "policy_version": "2026-07-01.1",
    "policy_ref": "https://verifier.example/policies/al2-crm-case-update/2026-07-01.1"
  },
  "decision": {
    "outcome": "allow",
    "reason_codes": [
      "STATUS_FRESH",
      "POLICY_MATCH"
    ]
  }
}
