{
  "version": "vate-0.2",
  "profile": "VATE-AL2-Verifier-Admission-v0.2",
  "receipt_type": "admission",
  "receipt_id": "admrec-20260701-evidence-type-not-allowed-001",
  "issued_at": "2026-07-01T00:11:08Z",
  "expires_at": "2026-07-01T00:21:08Z",
  "verifier": {
    "id": "did:web:verifier.example"
  },
  "request": {
    "request_id": "areq-20260701-evidence-type-not-allowed-001",
    "transaction_id": "txn-20260701-evidence-type-not-allowed-001",
    "action": "storage.object.publish",
    "input_hash": "sha-256:76fe5abd94b86ddf6dbd1e05f64d28846ec6ff042d854919b5cf15f80ca6a778"
  },
  "subject": {
    "principal": "did:web:user.example",
    "actor": "did:web:agent.example",
    "runtime": "spiffe://agent.example/workload/publish-agent"
  },
  "evidence": [
    {
      "type": "payment_authority",
      "uri": "https://agent.example/payment-authorities/not-allowed-001",
      "digest": {
        "alg": "sha-256",
        "value": "320906654f316e7bd0218cd8cd14d65a38efc687676b9f8f089dae786c7399c0"
      },
      "verification": {
        "result": "failed",
        "checked_at": "2026-07-01T00:11:05Z",
        "method": "trust-bundle-lookup",
        "failure_reason": "Issuer was known but not authorized for the presented evidence type."
      }
    }
  ],
  "policy": {
    "policy_id": "al2-storage-publish",
    "policy_version": "2026-07-01.1",
    "policy_ref": "https://verifier.example/policies/al2-storage-publish/2026-07-01.1"
  },
  "decision": {
    "outcome": "deny",
    "reason_codes": [
      "ISSUER_NOT_AUTHORIZED",
      "FAIL_CLOSED"
    ]
  }
}
