{
  "version": "vate-0.2",
  "profile": "VATE-AL2-Verifier-Admission-v0.2",
  "receipt_type": "admission",
  "receipt_id": "admrec-20260701-attenuation-max-amount-type-001",
  "issued_at": "2026-07-01T00:35:08Z",
  "expires_at": "2026-07-01T00:45:08Z",
  "verifier": {
    "id": "did:web:verifier.example"
  },
  "request": {
    "request_id": "areq-20260701-attenuation-max-amount-type-001",
    "transaction_id": "txn-20260701-attenuation-max-amount-type-001",
    "action": "commerce.purchase",
    "input_hash": "sha-256:cf912f1ee1caf3be59517b9d863bb5c57e4e58c6440e1395760c566ea6d28fe8"
  },
  "subject": {
    "principal": "did:web:user.example",
    "actor": "did:web:agent.example",
    "runtime": "spiffe://agent.example/workload/purchase-agent"
  },
  "evidence": [
    {
      "type": "attenuation_candidate",
      "uri": "conformance/al2-vate-v0.2/fixtures/attenuation-max-amount-type-edge.json",
      "digest": {
        "alg": "sha-256",
        "value": "01fcf4ba7fc2fa98506d4c0c20f9176fbc1e3ca5c13927530d8d70fad4c7992c"
      },
      "verification": {
        "result": "failed",
        "checked_at": "2026-07-01T00:35:05Z",
        "method": "attenuation-boundary-check",
        "failure_reason": "The attenuated max_amount value was not a finite scalar amount."
      }
    }
  ],
  "policy": {
    "policy_id": "merchant-purchase-al2",
    "policy_version": "2026-07-01.1",
    "policy_ref": "https://verifier.example/policies/merchant-purchase-al2/2026-07-01.1"
  },
  "decision": {
    "outcome": "deny",
    "reason_codes": [
      "SCHEMA_INVALID",
      "FAIL_CLOSED"
    ]
  }
}
