{
  "version": "vate-0.2",
  "profile": "VATE-AL2-Verifier-Admission-v0.2",
  "receipt_type": "admission",
  "receipt_id": "admrec-20260507-mcp-oauth-overscope-001",
  "issued_at": "2026-05-07T09:10:08Z",
  "expires_at": "2026-05-07T09:15:00Z",
  "verifier": {
    "id": "did:web:verifier.example",
    "key_id": "did:web:verifier.example#key-1"
  },
  "request": {
    "request_id": "areq-20260507-mcp-oauth-overscope-001",
    "transaction_id": "txn-20260507-mcp-oauth-overscope-001",
    "action": "crm.case.delete",
    "input_hash": "sha-256:base64url-mcp-overscope-tool-call-input-digest",
    "audience": "https://mcp.crm.example",
    "target_audience": "https://mcp.crm.example",
    "target_resource": "mcp://crm.example/tools/admin.delete",
    "transport": {
      "protocol": "mcp",
      "oauth": {
        "issuer": "https://auth.example",
        "audience": "https://mcp.crm.example",
        "resource": "mcp://crm.example/tools/cases.update",
        "proof_of_possession": "dpop-jkt:base64url-thumbprint"
      },
      "openid": {
        "issuer": "https://auth.example",
        "subject": "did:web:user.example",
        "client_id": "did:web:agent.example"
      }
    }
  },
  "subject": {
    "principal": "did:web:user.example",
    "actor": "did:web:agent.example",
    "runtime": "spiffe://agent.example/workload/case-agent"
  },
  "evidence": [
    {
      "type": "oauth_access_token",
      "protocol_hint": "mcp-oauth",
      "uri": "https://auth.example/token-introspection/tok-20260507-overscope-001",
      "digest": {
        "alg": "sha-256",
        "value": "94b2ba37bcf26c6cad0c32fb25592c87162a1aa2864ec3815ccc177aea958600"
      },
      "verification": {
        "result": "failed",
        "checked_at": "2026-05-07T09:10:01Z",
        "method": "oauth-resource-boundary-check",
        "status_result": "target_exceeds_token_resource",
        "failure_reason": "The requested MCP tool is outside the OAuth resource and MCP allowlist; VATE cannot union local policy with upstream authority."
      }
    },
    {
      "type": "openid_subject",
      "protocol_hint": "openid-connect",
      "uri": "https://auth.example/openid/session/sub-20260507-overscope-001",
      "digest": {
        "alg": "sha-256",
        "value": "94143dff74826f1b65568368ef1230026077010ab3926bd0eb29153002c358f8"
      },
      "verification": {
        "result": "verified",
        "checked_at": "2026-05-07T09:10:02Z",
        "method": "openid-claims-binding",
        "status_result": "active"
      }
    },
    {
      "type": "runtime_attestation",
      "protocol_hint": "spiffe",
      "uri": "https://agent.example/attestations/runtime/rp-mcp-oauth-overscope-001",
      "digest": {
        "alg": "sha-256",
        "value": "46061b99dfff172ee670c029ead9b4402090da1458a8b8857b682590549b56c7"
      },
      "verification": {
        "result": "verified",
        "checked_at": "2026-05-07T09:10:03Z",
        "method": "workload-attestation",
        "status_result": "active"
      }
    }
  ],
  "policy": {
    "policy_id": "al2-mcp-crm-case-update",
    "policy_version": "2026-05-07.1",
    "policy_ref": "https://verifier.example/policies/al2-mcp-crm-case-update/2026-05-07.1"
  },
  "decision": {
    "outcome": "deny",
    "reason_codes": [
      "TARGET_NOT_PERMITTED",
      "FAIL_CLOSED"
    ],
    "human_readable_summary": "The request is denied because the requested MCP tool would expand beyond the OAuth resource and MCP tool authorization."
  },
  "proof": {
    "format": "detached_jws",
    "alg": "ES256",
    "kid": "did:web:verifier.example#key-1",
    "signature_ref": "https://verifier.example/vate/signatures/admrec-20260507-mcp-oauth-overscope-001.jws"
  }
}
