{
  "version": "vate-0.2",
  "profile": "VATE-AL2-Verifier-Admission-v0.2",
  "receipt_type": "admission",
  "receipt_id": "admrec-20260701-target-scope-001",
  "issued_at": "2026-07-01T00:02:08Z",
  "expires_at": "2026-07-01T00:12:08Z",
  "verifier": {
    "id": "did:web:verifier.example"
  },
  "request": {
    "request_id": "areq-20260701-target-scope-001",
    "transaction_id": "txn-20260701-target-scope-001",
    "action": "storage.object.publish",
    "input_hash": "sha-256:1c9ca46e1ded4de46be039e9447dff129d06877ffb4bea69a925b8bfcb81c26f"
  },
  "subject": {
    "principal": "did:web:user.example",
    "actor": "did:web:agent.example",
    "runtime": "spiffe://agent.example/workload/publish-agent"
  },
  "evidence": [
    {
      "type": "mission_permit",
      "uri": "https://broker.example/permits/permit-target-scope-001",
      "digest": {
        "alg": "sha-256",
        "value": "6be188de04ca4ec1b0a3fde1067906aafe14dcd396902a1c4ef27a98ab4685c4"
      },
      "verification": {
        "result": "verified",
        "checked_at": "2026-07-01T00:02:05Z",
        "method": "permit-proof",
        "status_result": "attenuated"
      }
    }
  ],
  "policy": {
    "policy_id": "al2-storage-publish",
    "policy_version": "2026-07-01.1",
    "policy_ref": "https://verifier.example/policies/al2-storage-publish/2026-07-01.1"
  },
  "decision": {
    "outcome": "attenuate",
    "reason_codes": [
      "TARGET_SCOPE_NARROWED"
    ]
  },
  "attenuation": {
    "mode": "narrow",
    "original_request_hash": "sha-256:1c30da503c034d5c19420263968b13cbfae1d9ff56b81219c3a3d4fa7fb01b42",
    "effective_request_hash": "sha-256:6f2388a2950e3a245ea55a4edaa653f48154e7bf31372bb8bd3ee558683b7334",
    "changes": [
      {
        "op": "replace",
        "path": "/target/resource",
        "from": "bucket:public/*",
        "to": "bucket:public/reports/*",
        "reason_code": "TARGET_SCOPE_NARROWED"
      }
    ],
    "effective_constraints": {
      "target_resource": "bucket:public/reports/*"
    },
    "require_new_permit": false
  }
}
